CREATE SERVER fuseki
FOREIGN DATA WRAPPER rdf_fdw 
OPTIONS (
  endpoint   'http://fuseki:3030/dt/sparql',
  update_url 'http://fuseki:3030/dt/update',
  http_proxy 'http://172.19.42.101:3128',
  connect_timeout '1');
CREATE FOREIGN TABLE ft (
  subject   rdfnode OPTIONS (variable '?s'),
  predicate rdfnode OPTIONS (variable '?p'),
  object    rdfnode OPTIONS (variable '?o') 
)
SERVER fuseki OPTIONS (
  log_sparql 'true',
  sparql 'SELECT * WHERE {?s ?p ?o}',
  sparql_update_pattern '?s ?p ?o .'
);
CREATE USER MAPPING FOR postgres
SERVER fuseki OPTIONS (
  user 'admin', password 'secret',
  proxy_user 'proxyuser', proxy_password 'proxypass');
/* Correct proxy settings */
INSERT INTO ft (subject, predicate, object)
VALUES  ('<https://www.uni-muenster.de>', '<http://dbpedia.org/property/name>', '"Westfälische Wilhelms-Universität Münster"@de');
INFO:  SPARQL query sent to 'fuseki':
INSERT DATA { <https://www.uni-muenster.de> <http://dbpedia.org/property/name> "Westfälische Wilhelms-Universität Münster"@de };


SELECT * FROM ft;
INFO:  SPARQL query sent to 'fuseki':

SELECT ?s ?p ?o 
{?s ?p ?o}

INFO:  SPARQL returned 1 record.

            subject            |             predicate              |                     object                     
-------------------------------+------------------------------------+------------------------------------------------
 <https://www.uni-muenster.de> | <http://dbpedia.org/property/name> | "Westfälische Wilhelms-Universität Münster"@de
(1 row)

SELECT *
FROM sparql.describe('fuseki', 'DESCRIBE <https://www.uni-muenster.de>');
            subject            |             predicate              |                     object                     
-------------------------------+------------------------------------+------------------------------------------------
 <https://www.uni-muenster.de> | <http://dbpedia.org/property/name> | "Westfälische Wilhelms-Universität Münster"@de
(1 row)

CALL rdf_fdw_clone_table(
        create_table => true,
        foreign_table => 'public.ft',
        target_table  => 'public.t1'
     );
INFO:  SPARQL query sent to 'fuseki':

SELECT ?s ?p ?o 
{?s ?p ?o}
ORDER BY ASC(?s) 
OFFSET 0 LIMIT 100

INFO:  SPARQL returned 1 record.

INFO:  SPARQL query sent to 'fuseki':

SELECT ?s ?p ?o 
{?s ?p ?o}
ORDER BY ASC(?s) 
OFFSET 100 LIMIT 100

INFO:  SPARQL returned 0 records.

SELECT * FROM public.t1;
            subject            |             predicate              |                     object                     
-------------------------------+------------------------------------+------------------------------------------------
 <https://www.uni-muenster.de> | <http://dbpedia.org/property/name> | "Westfälische Wilhelms-Universität Münster"@de
(1 row)

UPDATE ft SET object = '"University of Münster"@en'
WHERE subject = '<https://www.uni-muenster.de>';
INFO:  SPARQL query sent to 'fuseki':

SELECT ?s ?p ?o 
{?s ?p ?o
 ## rdf_fdw pushdown conditions ##
 FILTER(?s = <https://www.uni-muenster.de>)
}

INFO:  SPARQL returned 1 record.

INFO:  SPARQL query sent to 'fuseki':
DELETE DATA { <https://www.uni-muenster.de> <http://dbpedia.org/property/name> "Westfälische Wilhelms-Universität Münster"@de };
INSERT DATA { <https://www.uni-muenster.de> <http://dbpedia.org/property/name> "University of Münster"@en };


SELECT * FROM ft;
INFO:  SPARQL query sent to 'fuseki':

SELECT ?s ?p ?o 
{?s ?p ?o}

INFO:  SPARQL returned 1 record.

            subject            |             predicate              |           object           
-------------------------------+------------------------------------+----------------------------
 <https://www.uni-muenster.de> | <http://dbpedia.org/property/name> | "University of Münster"@en
(1 row)

DELETE FROM ft;
INFO:  SPARQL query sent to 'fuseki':

SELECT ?s ?p ?o 
{?s ?p ?o}

INFO:  SPARQL returned 1 record.

INFO:  SPARQL query sent to 'fuseki':
DELETE DATA { <https://www.uni-muenster.de> <http://dbpedia.org/property/name> "University of Münster"@en };


SELECT * FROM ft;
INFO:  SPARQL query sent to 'fuseki':

SELECT ?s ?p ?o 
{?s ?p ?o}

INFO:  SPARQL returned 0 records.

 subject | predicate | object 
---------+-----------+--------
(0 rows)

/* Wrong user - must fail */
ALTER USER MAPPING FOR postgres SERVER fuseki OPTIONS (SET proxy_user 'wronguser');
SELECT * FROM ft;
INFO:  SPARQL query sent to 'fuseki':

SELECT ?s ?p ?o 
{?s ?p ?o}

ERROR:  proxy authentication required on server "fuseki" (HTTP 407)
DETAIL:  <!DOCTYPE html PUBLIC "-//W3C//DTD HTML 4.01//EN" "http://www.w3.org/TR/html4/strict.dtd">
<html><head>
<meta type="copyright" content="Copyright (C) 1996-2021 The Squid Software Foundation and contributors">
<meta http-equiv="Content-Type" content="text/html; charset=utf-8">
<title>ERROR: Cache Access Denied</title>
<style type="text/css"><!-- 
 /*
 * Copyright (C) 1996-2024 The Squid Software Foundation and contributors
 *
 * Squid software is distributed under GPLv2+ license and includes
 * contributions... (truncated)
HINT:  The endpoint requires proxy authentication. Check the proxy settings.
SELECT * FROM sparql.describe('fuseki', 'DESCRIBE <https://www.uni-muenster.de>');
ERROR:  proxy authentication required on server "fuseki" (HTTP 407)
DETAIL:  <!DOCTYPE html PUBLIC "-//W3C//DTD HTML 4.01//EN" "http://www.w3.org/TR/html4/strict.dtd">
<html><head>
<meta type="copyright" content="Copyright (C) 1996-2021 The Squid Software Foundation and contributors">
<meta http-equiv="Content-Type" content="text/html; charset=utf-8">
<title>ERROR: Cache Access Denied</title>
<style type="text/css"><!-- 
 /*
 * Copyright (C) 1996-2024 The Squid Software Foundation and contributors
 *
 * Squid software is distributed under GPLv2+ license and includes
 * contributions... (truncated)
HINT:  The endpoint requires proxy authentication. Check the proxy settings.
CALL rdf_fdw_clone_table(
        foreign_table => 'public.ft',
        target_table  => 'public.t1'
     );
INFO:  SPARQL query sent to 'fuseki':

SELECT ?s ?p ?o 
{?s ?p ?o}
ORDER BY ASC(?s) 
OFFSET 0 LIMIT 100

ERROR:  proxy authentication required on server "fuseki" (HTTP 407)
DETAIL:  <!DOCTYPE html PUBLIC "-//W3C//DTD HTML 4.01//EN" "http://www.w3.org/TR/html4/strict.dtd">
<html><head>
<meta type="copyright" content="Copyright (C) 1996-2021 The Squid Software Foundation and contributors">
<meta http-equiv="Content-Type" content="text/html; charset=utf-8">
<title>ERROR: Cache Access Denied</title>
<style type="text/css"><!-- 
 /*
 * Copyright (C) 1996-2024 The Squid Software Foundation and contributors
 *
 * Squid software is distributed under GPLv2+ license and includes
 * contributions... (truncated)
HINT:  The endpoint requires proxy authentication. Check the proxy settings.
/* Wrong password - must fail */
ALTER USER MAPPING FOR postgres SERVER fuseki OPTIONS (SET proxy_user 'proxyuser', SET proxy_password 'wrongpass');
SELECT * FROM ft;
INFO:  SPARQL query sent to 'fuseki':

SELECT ?s ?p ?o 
{?s ?p ?o}

ERROR:  proxy authentication required on server "fuseki" (HTTP 407)
DETAIL:  <!DOCTYPE html PUBLIC "-//W3C//DTD HTML 4.01//EN" "http://www.w3.org/TR/html4/strict.dtd">
<html><head>
<meta type="copyright" content="Copyright (C) 1996-2021 The Squid Software Foundation and contributors">
<meta http-equiv="Content-Type" content="text/html; charset=utf-8">
<title>ERROR: Cache Access Denied</title>
<style type="text/css"><!-- 
 /*
 * Copyright (C) 1996-2024 The Squid Software Foundation and contributors
 *
 * Squid software is distributed under GPLv2+ license and includes
 * contributions... (truncated)
HINT:  The endpoint requires proxy authentication. Check the proxy settings.
SELECT * FROM sparql.describe('fuseki', 'DESCRIBE <https://www.uni-muenster.de>');
ERROR:  proxy authentication required on server "fuseki" (HTTP 407)
DETAIL:  <!DOCTYPE html PUBLIC "-//W3C//DTD HTML 4.01//EN" "http://www.w3.org/TR/html4/strict.dtd">
<html><head>
<meta type="copyright" content="Copyright (C) 1996-2021 The Squid Software Foundation and contributors">
<meta http-equiv="Content-Type" content="text/html; charset=utf-8">
<title>ERROR: Cache Access Denied</title>
<style type="text/css"><!-- 
 /*
 * Copyright (C) 1996-2024 The Squid Software Foundation and contributors
 *
 * Squid software is distributed under GPLv2+ license and includes
 * contributions... (truncated)
HINT:  The endpoint requires proxy authentication. Check the proxy settings.
CALL rdf_fdw_clone_table(
        foreign_table => 'public.ft',
        target_table  => 'public.t1'
     );
INFO:  SPARQL query sent to 'fuseki':

SELECT ?s ?p ?o 
{?s ?p ?o}
ORDER BY ASC(?s) 
OFFSET 0 LIMIT 100

ERROR:  proxy authentication required on server "fuseki" (HTTP 407)
DETAIL:  <!DOCTYPE html PUBLIC "-//W3C//DTD HTML 4.01//EN" "http://www.w3.org/TR/html4/strict.dtd">
<html><head>
<meta type="copyright" content="Copyright (C) 1996-2021 The Squid Software Foundation and contributors">
<meta http-equiv="Content-Type" content="text/html; charset=utf-8">
<title>ERROR: Cache Access Denied</title>
<style type="text/css"><!-- 
 /*
 * Copyright (C) 1996-2024 The Squid Software Foundation and contributors
 *
 * Squid software is distributed under GPLv2+ license and includes
 * contributions... (truncated)
HINT:  The endpoint requires proxy authentication. Check the proxy settings.
/* No password - must fail */
ALTER USER MAPPING FOR postgres SERVER fuseki OPTIONS (DROP proxy_password);
SELECT * FROM ft;
INFO:  SPARQL query sent to 'fuseki':

SELECT ?s ?p ?o 
{?s ?p ?o}

ERROR:  proxy authentication required on server "fuseki" (HTTP 407)
DETAIL:  <!DOCTYPE html PUBLIC "-//W3C//DTD HTML 4.01//EN" "http://www.w3.org/TR/html4/strict.dtd">
<html><head>
<meta type="copyright" content="Copyright (C) 1996-2021 The Squid Software Foundation and contributors">
<meta http-equiv="Content-Type" content="text/html; charset=utf-8">
<title>ERROR: Cache Access Denied</title>
<style type="text/css"><!-- 
 /*
 * Copyright (C) 1996-2024 The Squid Software Foundation and contributors
 *
 * Squid software is distributed under GPLv2+ license and includes
 * contributions... (truncated)
HINT:  The endpoint requires proxy authentication. Check the proxy settings.
SELECT * FROM sparql.describe('fuseki', 'DESCRIBE <https://www.uni-muenster.de>');
ERROR:  proxy authentication required on server "fuseki" (HTTP 407)
DETAIL:  <!DOCTYPE html PUBLIC "-//W3C//DTD HTML 4.01//EN" "http://www.w3.org/TR/html4/strict.dtd">
<html><head>
<meta type="copyright" content="Copyright (C) 1996-2021 The Squid Software Foundation and contributors">
<meta http-equiv="Content-Type" content="text/html; charset=utf-8">
<title>ERROR: Cache Access Denied</title>
<style type="text/css"><!-- 
 /*
 * Copyright (C) 1996-2024 The Squid Software Foundation and contributors
 *
 * Squid software is distributed under GPLv2+ license and includes
 * contributions... (truncated)
HINT:  The endpoint requires proxy authentication. Check the proxy settings.
CALL rdf_fdw_clone_table(
        foreign_table => 'public.ft',
        target_table  => 'public.t1'
     );
INFO:  SPARQL query sent to 'fuseki':

SELECT ?s ?p ?o 
{?s ?p ?o}
ORDER BY ASC(?s) 
OFFSET 0 LIMIT 100

ERROR:  proxy authentication required on server "fuseki" (HTTP 407)
DETAIL:  <!DOCTYPE html PUBLIC "-//W3C//DTD HTML 4.01//EN" "http://www.w3.org/TR/html4/strict.dtd">
<html><head>
<meta type="copyright" content="Copyright (C) 1996-2021 The Squid Software Foundation and contributors">
<meta http-equiv="Content-Type" content="text/html; charset=utf-8">
<title>ERROR: Cache Access Denied</title>
<style type="text/css"><!-- 
 /*
 * Copyright (C) 1996-2024 The Squid Software Foundation and contributors
 *
 * Squid software is distributed under GPLv2+ license and includes
 * contributions... (truncated)
HINT:  The endpoint requires proxy authentication. Check the proxy settings.
/* Cleanup */
DROP TABLE public.t1;
DROP SERVER fuseki CASCADE;
NOTICE:  drop cascades to 2 other objects
DETAIL:  drop cascades to foreign table ft
drop cascades to user mapping for postgres on server fuseki
