\pset null '(null)'
CREATE SERVER qlever
FOREIGN DATA WRAPPER rdf_fdw 
OPTIONS (
  endpoint   'http://qlever:7001/sparql',
  update_url 'http://qlever:7001/update');
CREATE USER MAPPING FOR postgres
SERVER qlever OPTIONS (token 'secret');
CREATE FOREIGN TABLE ft (
  subject   rdfnode OPTIONS (variable '?s'),
  predicate rdfnode OPTIONS (variable '?p'),
  object    rdfnode OPTIONS (variable '?o') 
)
SERVER qlever OPTIONS (
  log_sparql 'true',
  sparql 'SELECT * WHERE {?s ?p ?o}',
  sparql_update_pattern '?s ?p ?o .'
);
INSERT INTO ft (subject, predicate, object)
VALUES  ('<https://www.uni-muenster.de>', '<http://www.w3.org/2000/01/rdf-schema#label>', '"Westfälische Wilhelms-Universität Münster"@de');
INFO:  SPARQL query sent to 'qlever':
INSERT DATA { <https://www.uni-muenster.de> <http://www.w3.org/2000/01/rdf-schema#label> "Westfälische Wilhelms-Universität Münster"@de };


SELECT * FROM ft
WHERE subject = '<https://www.uni-muenster.de>';
INFO:  SPARQL query sent to 'qlever':

SELECT ?s ?p ?o 
{?s ?p ?o
 ## rdf_fdw pushdown conditions ##
 FILTER(?s = <https://www.uni-muenster.de>)
}

INFO:  SPARQL returned 1 record.

            subject            |                  predicate                   |                     object                     
-------------------------------+----------------------------------------------+------------------------------------------------
 <https://www.uni-muenster.de> | <http://www.w3.org/2000/01/rdf-schema#label> | "Westfälische Wilhelms-Universität Münster"@de
(1 row)

UPDATE ft SET
  object = '"University of Münster"@en'
WHERE subject = '<https://www.uni-muenster.de>'
  AND predicate = '<http://www.w3.org/2000/01/rdf-schema#label>';
INFO:  SPARQL query sent to 'qlever':

SELECT ?s ?p ?o 
{?s ?p ?o
 ## rdf_fdw pushdown conditions ##
 FILTER(?s = <https://www.uni-muenster.de>)
 FILTER(?p = <http://www.w3.org/2000/01/rdf-schema#label>)
}

INFO:  SPARQL returned 1 record.

INFO:  SPARQL query sent to 'qlever':
DELETE DATA { <https://www.uni-muenster.de> <http://www.w3.org/2000/01/rdf-schema#label> "Westfälische Wilhelms-Universität Münster"@de };
INSERT DATA { <https://www.uni-muenster.de> <http://www.w3.org/2000/01/rdf-schema#label> "University of Münster"@en };


SELECT * FROM ft
WHERE subject = '<https://www.uni-muenster.de>';
INFO:  SPARQL query sent to 'qlever':

SELECT ?s ?p ?o 
{?s ?p ?o
 ## rdf_fdw pushdown conditions ##
 FILTER(?s = <https://www.uni-muenster.de>)
}

INFO:  SPARQL returned 1 record.

            subject            |                  predicate                   |           object           
-------------------------------+----------------------------------------------+----------------------------
 <https://www.uni-muenster.de> | <http://www.w3.org/2000/01/rdf-schema#label> | "University of Münster"@en
(1 row)

UPDATE ft 
SET object = '""'::rdfnode
WHERE subject = '<https://www.uni-muenster.de>'
  AND predicate = '<http://www.w3.org/2000/01/rdf-schema#label>';
INFO:  SPARQL query sent to 'qlever':

SELECT ?s ?p ?o 
{?s ?p ?o
 ## rdf_fdw pushdown conditions ##
 FILTER(?s = <https://www.uni-muenster.de>)
 FILTER(?p = <http://www.w3.org/2000/01/rdf-schema#label>)
}

INFO:  SPARQL returned 1 record.

INFO:  SPARQL query sent to 'qlever':
DELETE DATA { <https://www.uni-muenster.de> <http://www.w3.org/2000/01/rdf-schema#label> "University of Münster"@en };
INSERT DATA { <https://www.uni-muenster.de> <http://www.w3.org/2000/01/rdf-schema#label> "" };


SELECT * FROM ft
WHERE subject = '<https://www.uni-muenster.de>';
INFO:  SPARQL query sent to 'qlever':

SELECT ?s ?p ?o 
{?s ?p ?o
 ## rdf_fdw pushdown conditions ##
 FILTER(?s = <https://www.uni-muenster.de>)
}

INFO:  SPARQL returned 1 record.

            subject            |                  predicate                   | object 
-------------------------------+----------------------------------------------+--------
 <https://www.uni-muenster.de> | <http://www.w3.org/2000/01/rdf-schema#label> | ""
(1 row)

UPDATE ft 
SET object = '🐘'::rdfnode
WHERE subject = '<https://www.uni-muenster.de>'
  AND predicate = '<http://www.w3.org/2000/01/rdf-schema#label>';
INFO:  SPARQL query sent to 'qlever':

SELECT ?s ?p ?o 
{?s ?p ?o
 ## rdf_fdw pushdown conditions ##
 FILTER(?s = <https://www.uni-muenster.de>)
 FILTER(?p = <http://www.w3.org/2000/01/rdf-schema#label>)
}

INFO:  SPARQL returned 1 record.

INFO:  SPARQL query sent to 'qlever':
DELETE DATA { <https://www.uni-muenster.de> <http://www.w3.org/2000/01/rdf-schema#label> "" };
INSERT DATA { <https://www.uni-muenster.de> <http://www.w3.org/2000/01/rdf-schema#label> "🐘" };


SELECT * FROM ft
WHERE subject = '<https://www.uni-muenster.de>';
INFO:  SPARQL query sent to 'qlever':

SELECT ?s ?p ?o 
{?s ?p ?o
 ## rdf_fdw pushdown conditions ##
 FILTER(?s = <https://www.uni-muenster.de>)
}

INFO:  SPARQL returned 1 record.

            subject            |                  predicate                   | object 
-------------------------------+----------------------------------------------+--------
 <https://www.uni-muenster.de> | <http://www.w3.org/2000/01/rdf-schema#label> | "🐘"
(1 row)

/* update using existing column */
UPDATE ft 
SET object = predicate
WHERE subject = '<https://www.uni-muenster.de>'
  AND predicate = '<http://www.w3.org/2000/01/rdf-schema#label>';
INFO:  SPARQL query sent to 'qlever':

SELECT ?s ?p ?o 
{?s ?p ?o
 ## rdf_fdw pushdown conditions ##
 FILTER(?s = <https://www.uni-muenster.de>)
 FILTER(?p = <http://www.w3.org/2000/01/rdf-schema#label>)
}

INFO:  SPARQL returned 1 record.

INFO:  SPARQL query sent to 'qlever':
DELETE DATA { <https://www.uni-muenster.de> <http://www.w3.org/2000/01/rdf-schema#label> "🐘" };
INSERT DATA { <https://www.uni-muenster.de> <http://www.w3.org/2000/01/rdf-schema#label> <http://www.w3.org/2000/01/rdf-schema#label> };


SELECT * FROM ft
WHERE subject = '<https://www.uni-muenster.de>';
INFO:  SPARQL query sent to 'qlever':

SELECT ?s ?p ?o 
{?s ?p ?o
 ## rdf_fdw pushdown conditions ##
 FILTER(?s = <https://www.uni-muenster.de>)
}

INFO:  SPARQL returned 1 record.

            subject            |                  predicate                   |                    object                    
-------------------------------+----------------------------------------------+----------------------------------------------
 <https://www.uni-muenster.de> | <http://www.w3.org/2000/01/rdf-schema#label> | <http://www.w3.org/2000/01/rdf-schema#label>
(1 row)

/* update literals with quotes */
UPDATE ft 
SET object = '"\"text with quotes\""'::rdfnode
WHERE subject = '<https://www.uni-muenster.de>'
  AND predicate = '<http://www.w3.org/2000/01/rdf-schema#label>';
INFO:  SPARQL query sent to 'qlever':

SELECT ?s ?p ?o 
{?s ?p ?o
 ## rdf_fdw pushdown conditions ##
 FILTER(?s = <https://www.uni-muenster.de>)
 FILTER(?p = <http://www.w3.org/2000/01/rdf-schema#label>)
}

INFO:  SPARQL returned 1 record.

INFO:  SPARQL query sent to 'qlever':
DELETE DATA { <https://www.uni-muenster.de> <http://www.w3.org/2000/01/rdf-schema#label> <http://www.w3.org/2000/01/rdf-schema#label> };
INSERT DATA { <https://www.uni-muenster.de> <http://www.w3.org/2000/01/rdf-schema#label> "\"text with quotes\"" };


SELECT * FROM ft
WHERE subject = '<https://www.uni-muenster.de>';
INFO:  SPARQL query sent to 'qlever':

SELECT ?s ?p ?o 
{?s ?p ?o
 ## rdf_fdw pushdown conditions ##
 FILTER(?s = <https://www.uni-muenster.de>)
}

INFO:  SPARQL returned 1 record.

            subject            |                  predicate                   |         object         
-------------------------------+----------------------------------------------+------------------------
 <https://www.uni-muenster.de> | <http://www.w3.org/2000/01/rdf-schema#label> | "\"text with quotes\""
(1 row)

/* update literals containing newlines */
UPDATE ft 
SET object = '"text \n newline"'::rdfnode
WHERE subject = '<https://www.uni-muenster.de>'
  AND predicate = '<http://www.w3.org/2000/01/rdf-schema#label>';
INFO:  SPARQL query sent to 'qlever':

SELECT ?s ?p ?o 
{?s ?p ?o
 ## rdf_fdw pushdown conditions ##
 FILTER(?s = <https://www.uni-muenster.de>)
 FILTER(?p = <http://www.w3.org/2000/01/rdf-schema#label>)
}

INFO:  SPARQL returned 1 record.

INFO:  SPARQL query sent to 'qlever':
DELETE DATA { <https://www.uni-muenster.de> <http://www.w3.org/2000/01/rdf-schema#label> "\"text with quotes\"" };
INSERT DATA { <https://www.uni-muenster.de> <http://www.w3.org/2000/01/rdf-schema#label> "text \n newline" };


SELECT * FROM ft
WHERE subject = '<https://www.uni-muenster.de>';
INFO:  SPARQL query sent to 'qlever':

SELECT ?s ?p ?o 
{?s ?p ?o
 ## rdf_fdw pushdown conditions ##
 FILTER(?s = <https://www.uni-muenster.de>)
}

INFO:  SPARQL returned 1 record.

            subject            |                  predicate                   |  object   
-------------------------------+----------------------------------------------+-----------
 <https://www.uni-muenster.de> | <http://www.w3.org/2000/01/rdf-schema#label> | "text    +
                               |                                              |  newline"
(1 row)

/* update to xsd:string literal (per RDF 1.1, xsd:string is equivalent to a plain literal;
   both QLever and GraphDB return it without the ^^xsd:string datatype annotation) */
UPDATE ft 
SET object = '"text xsd string"^^<http://www.w3.org/2001/XMLSchema#string>'::rdfnode
WHERE subject = '<https://www.uni-muenster.de>'
  AND predicate = '<http://www.w3.org/2000/01/rdf-schema#label>';
INFO:  SPARQL query sent to 'qlever':

SELECT ?s ?p ?o 
{?s ?p ?o
 ## rdf_fdw pushdown conditions ##
 FILTER(?s = <https://www.uni-muenster.de>)
 FILTER(?p = <http://www.w3.org/2000/01/rdf-schema#label>)
}

INFO:  SPARQL returned 1 record.

INFO:  SPARQL query sent to 'qlever':
DELETE DATA { <https://www.uni-muenster.de> <http://www.w3.org/2000/01/rdf-schema#label> "text \n newline" };
INSERT DATA { <https://www.uni-muenster.de> <http://www.w3.org/2000/01/rdf-schema#label> "text xsd string"^^<http://www.w3.org/2001/XMLSchema#string> };


SELECT * FROM ft
WHERE subject = '<https://www.uni-muenster.de>';
INFO:  SPARQL query sent to 'qlever':

SELECT ?s ?p ?o 
{?s ?p ?o
 ## rdf_fdw pushdown conditions ##
 FILTER(?s = <https://www.uni-muenster.de>)
}

INFO:  SPARQL returned 1 record.

            subject            |                  predicate                   |      object       
-------------------------------+----------------------------------------------+-------------------
 <https://www.uni-muenster.de> | <http://www.w3.org/2000/01/rdf-schema#label> | "text xsd string"
(1 row)

/* update to xsd:int literal */
UPDATE ft 
SET object = 42::rdfnode
WHERE subject = '<https://www.uni-muenster.de>'
  AND predicate = '<http://www.w3.org/2000/01/rdf-schema#label>';
INFO:  SPARQL query sent to 'qlever':

SELECT ?s ?p ?o 
{?s ?p ?o
 ## rdf_fdw pushdown conditions ##
 FILTER(?s = <https://www.uni-muenster.de>)
 FILTER(?p = <http://www.w3.org/2000/01/rdf-schema#label>)
}

INFO:  SPARQL returned 1 record.

INFO:  SPARQL query sent to 'qlever':
DELETE DATA { <https://www.uni-muenster.de> <http://www.w3.org/2000/01/rdf-schema#label> "text xsd string" };
INSERT DATA { <https://www.uni-muenster.de> <http://www.w3.org/2000/01/rdf-schema#label> "42"^^<http://www.w3.org/2001/XMLSchema#int> };


SELECT * FROM ft
WHERE subject = '<https://www.uni-muenster.de>';
INFO:  SPARQL query sent to 'qlever':

SELECT ?s ?p ?o 
{?s ?p ?o
 ## rdf_fdw pushdown conditions ##
 FILTER(?s = <https://www.uni-muenster.de>)
}

INFO:  SPARQL returned 1 record.

            subject            |                  predicate                   |                    object                    
-------------------------------+----------------------------------------------+----------------------------------------------
 <https://www.uni-muenster.de> | <http://www.w3.org/2000/01/rdf-schema#label> | "42"^^<http://www.w3.org/2001/XMLSchema#int>
(1 row)

/* update to xsd:decimal literal */
UPDATE ft 
SET object = 42.37::rdfnode
WHERE subject = '<https://www.uni-muenster.de>'
  AND predicate = '<http://www.w3.org/2000/01/rdf-schema#label>';
INFO:  SPARQL query sent to 'qlever':

SELECT ?s ?p ?o 
{?s ?p ?o
 ## rdf_fdw pushdown conditions ##
 FILTER(?s = <https://www.uni-muenster.de>)
 FILTER(?p = <http://www.w3.org/2000/01/rdf-schema#label>)
}

INFO:  SPARQL returned 1 record.

INFO:  SPARQL query sent to 'qlever':
DELETE DATA { <https://www.uni-muenster.de> <http://www.w3.org/2000/01/rdf-schema#label> "42"^^<http://www.w3.org/2001/XMLSchema#int> };
INSERT DATA { <https://www.uni-muenster.de> <http://www.w3.org/2000/01/rdf-schema#label> "42.37"^^<http://www.w3.org/2001/XMLSchema#decimal> };


SELECT * FROM ft
WHERE subject = '<https://www.uni-muenster.de>';
INFO:  SPARQL query sent to 'qlever':

SELECT ?s ?p ?o 
{?s ?p ?o
 ## rdf_fdw pushdown conditions ##
 FILTER(?s = <https://www.uni-muenster.de>)
}

INFO:  SPARQL returned 1 record.

            subject            |                  predicate                   |                       object                        
-------------------------------+----------------------------------------------+-----------------------------------------------------
 <https://www.uni-muenster.de> | <http://www.w3.org/2000/01/rdf-schema#label> | "42.37"^^<http://www.w3.org/2001/XMLSchema#decimal>
(1 row)

/* update to xsd:long literal
   Note: QLever normalizes all XSD integer subtypes (xsd:short, xsd:long, etc.) to xsd:int
   internally, so the value is returned as "423712345678911"^^xsd:int even though it was
   inserted as xsd:long and exceeds xsd:int's maximum value (2,147,483,647). */
UPDATE ft 
SET object = 423712345678911::rdfnode
WHERE subject = '<https://www.uni-muenster.de>'
  AND predicate = '<http://www.w3.org/2000/01/rdf-schema#label>';
INFO:  SPARQL query sent to 'qlever':

SELECT ?s ?p ?o 
{?s ?p ?o
 ## rdf_fdw pushdown conditions ##
 FILTER(?s = <https://www.uni-muenster.de>)
 FILTER(?p = <http://www.w3.org/2000/01/rdf-schema#label>)
}

INFO:  SPARQL returned 1 record.

INFO:  SPARQL query sent to 'qlever':
DELETE DATA { <https://www.uni-muenster.de> <http://www.w3.org/2000/01/rdf-schema#label> "42.37"^^<http://www.w3.org/2001/XMLSchema#decimal> };
INSERT DATA { <https://www.uni-muenster.de> <http://www.w3.org/2000/01/rdf-schema#label> "423712345678911"^^<http://www.w3.org/2001/XMLSchema#long> };


SELECT * FROM ft
WHERE subject = '<https://www.uni-muenster.de>';
INFO:  SPARQL query sent to 'qlever':

SELECT ?s ?p ?o 
{?s ?p ?o
 ## rdf_fdw pushdown conditions ##
 FILTER(?s = <https://www.uni-muenster.de>)
}

INFO:  SPARQL returned 1 record.

            subject            |                  predicate                   |                          object                           
-------------------------------+----------------------------------------------+-----------------------------------------------------------
 <https://www.uni-muenster.de> | <http://www.w3.org/2000/01/rdf-schema#label> | "423712345678911"^^<http://www.w3.org/2001/XMLSchema#int>
(1 row)

/* update with NULL - must fail (after SELECT since FDW must fetch OLD values first) */
UPDATE ft 
SET object = NULL
WHERE subject = '<https://www.uni-muenster.de>'
  AND predicate = '<http://www.w3.org/2000/01/rdf-schema#label>';
INFO:  SPARQL query sent to 'qlever':

SELECT ?s ?p ?o 
{?s ?p ?o
 ## rdf_fdw pushdown conditions ##
 FILTER(?s = <https://www.uni-muenster.de>)
 FILTER(?p = <http://www.w3.org/2000/01/rdf-schema#label>)
}

INFO:  SPARQL returned 1 record.

ERROR:  NULL value in column "object" violates RDF constraint
DETAIL:  SPARQL variable '?o' cannot be NULL in RDF triple patterns.
HINT:  RDF triples require all components to be non-NULL. Filter NULL values in your query or provide default values.
SELECT * FROM ft
WHERE subject = '<https://www.uni-muenster.de>';
INFO:  SPARQL query sent to 'qlever':

SELECT ?s ?p ?o 
{?s ?p ?o
 ## rdf_fdw pushdown conditions ##
 FILTER(?s = <https://www.uni-muenster.de>)
}

INFO:  SPARQL returned 1 record.

            subject            |                  predicate                   |                          object                           
-------------------------------+----------------------------------------------+-----------------------------------------------------------
 <https://www.uni-muenster.de> | <http://www.w3.org/2000/01/rdf-schema#label> | "423712345678911"^^<http://www.w3.org/2001/XMLSchema#int>
(1 row)

/* update rdfnode with a blank node */
UPDATE ft 
SET object = sparql.bnode()
WHERE subject = '<https://www.uni-muenster.de>'
  AND predicate = '<http://www.w3.org/2000/01/rdf-schema#label>';
INFO:  SPARQL query sent to 'qlever':

SELECT ?s ?p ?o 
{?s ?p ?o
 ## rdf_fdw pushdown conditions ##
 FILTER(?s = <https://www.uni-muenster.de>)
 FILTER(?p = <http://www.w3.org/2000/01/rdf-schema#label>)
}

INFO:  SPARQL returned 1 record.

ERROR:  blank nodes are not allowed in UPDATE operations
HINT:  Blank nodes are document-local and have no global meaning. Use IRIs instead.
/* update with RETURNING */
UPDATE ft SET
  object = '"Westfälische Wilhelms-Universität Münster"@de'
WHERE subject = '<https://www.uni-muenster.de>'
  AND predicate = '<http://www.w3.org/2000/01/rdf-schema#label>'
RETURNING OLD.subject, OLD.predicate, OLD.object,
          NEW.subject AS new_subject, NEW.predicate AS new_predicate, NEW.object AS new_object;
INFO:  SPARQL query sent to 'qlever':

SELECT ?s ?p ?o 
{?s ?p ?o
 ## rdf_fdw pushdown conditions ##
 FILTER(?s = <https://www.uni-muenster.de>)
 FILTER(?p = <http://www.w3.org/2000/01/rdf-schema#label>)
}

INFO:  SPARQL returned 1 record.

INFO:  SPARQL query sent to 'qlever':
DELETE DATA { <https://www.uni-muenster.de> <http://www.w3.org/2000/01/rdf-schema#label> "423712345678911"^^<http://www.w3.org/2001/XMLSchema#int> };
INSERT DATA { <https://www.uni-muenster.de> <http://www.w3.org/2000/01/rdf-schema#label> "Westfälische Wilhelms-Universität Münster"@de };


            subject            |                  predicate                   |                          object                           |          new_subject          |                new_predicate                 |                   new_object                   
-------------------------------+----------------------------------------------+-----------------------------------------------------------+-------------------------------+----------------------------------------------+------------------------------------------------
 <https://www.uni-muenster.de> | <http://www.w3.org/2000/01/rdf-schema#label> | "423712345678911"^^<http://www.w3.org/2001/XMLSchema#int> | <https://www.uni-muenster.de> | <http://www.w3.org/2000/01/rdf-schema#label> | "Westfälische Wilhelms-Universität Münster"@de
(1 row)

/* invalid credentials test */
ALTER USER MAPPING FOR postgres
SERVER qlever OPTIONS (SET token 'wrongtoken'); -- wrong token
UPDATE ft SET
  object = '"University of Münster"@en'
WHERE subject = '<https://www.uni-muenster.de>'
  AND predicate = '<http://www.w3.org/2000/01/rdf-schema#label>';
INFO:  SPARQL query sent to 'qlever':

SELECT ?s ?p ?o 
{?s ?p ?o
 ## rdf_fdw pushdown conditions ##
 FILTER(?s = <https://www.uni-muenster.de>)
 FILTER(?p = <http://www.w3.org/2000/01/rdf-schema#label>)
}

ERROR:  SPARQL query error
DETAIL:  Access token was provided but it was invalid
HINT:  The SPARQL endpoint returned: Bad Request (HTTP 400).
ALTER USER MAPPING FOR postgres
SERVER qlever OPTIONS (SET token 'secret'); -- restore correct token
/* read-only server: blocks UPDATE regardless of triple pattern */
ALTER SERVER qlever OPTIONS (ADD readonly 'true');
UPDATE ft SET object = '"foo"@en';
ERROR:  foreign table "ft" does not allow updates
/* table overrides server: server is readonly but table explicitly sets readonly=false */
ALTER FOREIGN TABLE ft OPTIONS (ADD readonly 'false');
UPDATE ft SET object = '"foo"@en'; -- succeeds: table override allows writes
INFO:  SPARQL query sent to 'qlever':

SELECT ?s ?p ?o 
{?s ?p ?o}

INFO:  SPARQL returned 2 records.

INFO:  SPARQL query sent to 'qlever':
DELETE DATA { <https://www.uni-muenster.de> <http://www.w3.org/2000/01/rdf-schema#label> "Westfälische Wilhelms-Universität Münster"@de };
INSERT DATA { <https://www.uni-muenster.de> <http://www.w3.org/2000/01/rdf-schema#label> "foo"@en };
DELETE DATA { <http://example.org/s> <http://example.org/p> <http://example.org/o> };
INSERT DATA { <http://example.org/s> <http://example.org/p> "foo"@en };


SELECT * FROM ft WHERE subject = '<https://www.uni-muenster.de>';
INFO:  SPARQL query sent to 'qlever':

SELECT ?s ?p ?o 
{?s ?p ?o
 ## rdf_fdw pushdown conditions ##
 FILTER(?s = <https://www.uni-muenster.de>)
}

INFO:  SPARQL returned 1 record.

            subject            |                  predicate                   |  object  
-------------------------------+----------------------------------------------+----------
 <https://www.uni-muenster.de> | <http://www.w3.org/2000/01/rdf-schema#label> | "foo"@en
(1 row)

ALTER FOREIGN TABLE ft OPTIONS (DROP readonly);
/* read-only foreign table: server is writable, table explicitly read-only */
ALTER SERVER qlever OPTIONS (SET readonly 'false');
ALTER FOREIGN TABLE ft OPTIONS (ADD readonly 'true');
UPDATE ft SET object = '"foo"@en';
ERROR:  foreign table "ft" does not allow updates
/* read-write server and foreign table, but no triple pattern */
ALTER SERVER qlever OPTIONS (DROP readonly);
ALTER FOREIGN TABLE ft OPTIONS (DROP readonly);
ALTER FOREIGN TABLE ft OPTIONS (DROP sparql_update_pattern);
UPDATE ft SET object = '"foo"@en';
ERROR:  foreign table "ft" does not allow updates
/* invalid triple patterns */
ALTER FOREIGN TABLE ft OPTIONS (ADD sparql_update_pattern '?s ?p .'); -- missing object variable
UPDATE ft SET object = '"foo"@en';
INFO:  SPARQL query sent to 'qlever':

SELECT ?s ?p ?o 
{?s ?p ?o}

INFO:  SPARQL returned 2 records.

ERROR:  'sparql_update_pattern' contains no valid triple patterns
HINT:  A triple pattern requires at least three components (subject, predicate, object), e.g., '?s ?p ?o .'.
ALTER FOREIGN TABLE ft OPTIONS (SET sparql_update_pattern ''); -- empty pattern
ERROR:  empty value in option 'sparql_update_pattern'
UPDATE ft SET object = '"foo"@en';
INFO:  SPARQL query sent to 'qlever':

SELECT ?s ?p ?o 
{?s ?p ?o}

INFO:  SPARQL returned 2 records.

ERROR:  'sparql_update_pattern' contains no valid triple patterns
HINT:  A triple pattern requires at least three components (subject, predicate, object), e.g., '?s ?p ?o .'.
/* invalid data type */
ALTER FOREIGN TABLE ft OPTIONS (SET sparql_update_pattern '?s ?p ?o .'); -- restore correct pattern
ALTER FOREIGN TABLE ft ALTER COLUMN predicate TYPE text;
UPDATE ft SET object = '"foo"@en';
WARNING:  the rdf_fdw FOREIGN TABLE "ft" has columns using native PostgreSQL types which are deprecated: predicate
HINT:  Use the "rdfnode" type instead.
INFO:  SPARQL query sent to 'qlever':

SELECT ?s ?p ?o 
{?s ?p ?o}

INFO:  SPARQL returned 2 records.

WARNING:  the rdf_fdw FOREIGN TABLE "ft" has columns using native PostgreSQL types which are deprecated: predicate
HINT:  Use the "rdfnode" type instead.
ERROR:  invalid data type for UPDATE on column "predicate"
DETAIL:  Only columns of type rdfnode can be used in UPDATE operations.
ALTER FOREIGN TABLE ft ALTER COLUMN predicate TYPE rdfnode;
/* cleanup */
UPDATE ft SET object = '"updated"'::rdfnode WHERE subject IN (SELECT subject FROM ft WHERE predicate = '<http://foo.bar>');
INFO:  SPARQL query sent to 'qlever':

SELECT ?s ?p ?o 
{?s ?p ?o}

INFO:  SPARQL returned 2 records.

INFO:  SPARQL query sent to 'qlever':

SELECT ?s ?p 
{?s ?p ?o
 ## rdf_fdw pushdown conditions ##
 FILTER(?p = <http://foo.bar>)
}

INFO:  SPARQL returned 0 records.

UPDATE ft SET object = '"updated"'::rdfnode WHERE subject IN (SELECT subject FROM ft WHERE predicate <> '<http://foo.bar>');
INFO:  SPARQL query sent to 'qlever':

SELECT ?s ?p ?o 
{?s ?p ?o}

INFO:  SPARQL returned 2 records.

INFO:  SPARQL query sent to 'qlever':

SELECT ?s ?p 
{?s ?p ?o
 ## rdf_fdw pushdown conditions ##
 FILTER(?p != <http://foo.bar>)
}

INFO:  SPARQL returned 2 records.

INFO:  SPARQL query sent to 'qlever':
DELETE DATA { <http://example.org/s> <http://example.org/p> "foo"@en };
INSERT DATA { <http://example.org/s> <http://example.org/p> "updated" };
DELETE DATA { <https://www.uni-muenster.de> <http://www.w3.org/2000/01/rdf-schema#label> "foo"@en };
INSERT DATA { <https://www.uni-muenster.de> <http://www.w3.org/2000/01/rdf-schema#label> "updated" };


DELETE FROM ft;
INFO:  SPARQL query sent to 'qlever':

SELECT ?s ?p ?o 
{?s ?p ?o}

INFO:  SPARQL returned 2 records.

INFO:  SPARQL query sent to 'qlever':
DELETE DATA { <http://example.org/s> <http://example.org/p> "updated" };
DELETE DATA { <https://www.uni-muenster.de> <http://www.w3.org/2000/01/rdf-schema#label> "updated" };


DROP SERVER qlever CASCADE;
NOTICE:  drop cascades to 2 other objects
DETAIL:  drop cascades to user mapping for postgres on server qlever
drop cascades to foreign table ft
